{
  "schema": "wea.graph/v1",
  "schema_version": "1.0.0",
  "kind": "Graph",
  "graph_id": "sha256:1111111111111111111111111111111111111111111111111111111111111111",
  "revision_id": "sha256:2222222222222222222222222222222222222222222222222222222222222222",
  "parent_revision_id": null,
  "template_release_ref": null,
  "entry_node": "source",
  "nodes": [
    {
      "id": "source",
      "operation": {
        "kind": "task.load",
        "version": 1,
        "implementation_digest": "sha256:3333333333333333333333333333333333333333333333333333333333333333"
      },
      "ports": {
        "inputs": [],
        "outputs": [
          {
            "id": "task",
            "type": "wea/Task@1",
            "required": true
          }
        ]
      },
      "effects": {
        "read_scope": [],
        "write_scope": [],
        "write_semantics": "none",
        "network_access": "deny",
        "external_side_effects": "none",
        "determinism": "deterministic",
        "replay_policy": "safe"
      },
      "permissions": {
        "capabilities": [],
        "filesystem": {
          "read": [],
          "write": []
        },
        "network": "deny",
        "secrets": []
      },
      "cache_policy": {
        "allowed_modes": [
          "EXACT"
        ],
        "risk_class": "S0",
        "verifier_digests": [
          "sha256:4444444444444444444444444444444444444444444444444444444444444444"
        ],
        "max_age_seconds": null
      },
      "budget": {
        "wall_time_ms": 60000,
        "model_tokens": 10000,
        "monetary_microunits": 1000000
      },
      "timeout_ms": 1000,
      "retry_limit": 0
    },
    {
      "id": "accept",
      "operation": {
        "kind": "acceptance.plan",
        "version": 1,
        "implementation_digest": "sha256:5555555555555555555555555555555555555555555555555555555555555555"
      },
      "ports": {
        "inputs": [
          {
            "id": "task",
            "type": "wea/Task@1",
            "required": true
          }
        ],
        "outputs": [
          {
            "id": "acceptance",
            "type": "wea/Acceptance@1",
            "required": true
          }
        ]
      },
      "effects": {
        "read_scope": [],
        "write_scope": [],
        "write_semantics": "none",
        "network_access": "deny",
        "external_side_effects": "none",
        "determinism": "deterministic",
        "replay_policy": "safe"
      },
      "permissions": {
        "capabilities": [],
        "filesystem": {
          "read": [],
          "write": []
        },
        "network": "deny",
        "secrets": []
      },
      "cache_policy": {
        "allowed_modes": [
          "EXACT"
        ],
        "risk_class": "S0",
        "verifier_digests": [
          "sha256:6666666666666666666666666666666666666666666666666666666666666666"
        ],
        "max_age_seconds": null
      },
      "budget": {
        "wall_time_ms": 60000,
        "model_tokens": 10000,
        "monetary_microunits": 1000000
      },
      "timeout_ms": 1000,
      "retry_limit": 0
    }
  ],
  "edges": [
    {
      "id": "task_to_accept",
      "from": {
        "node": "source",
        "port": "task"
      },
      "to": {
        "node": "accept",
        "port": "task"
      },
      "kind": "DATA",
      "required": true,
      "transform_digest": null,
      "loop_id": null
    }
  ],
  "control": {
    "scheduler": "dataflow",
    "activation": "all_required_inputs",
    "max_parallelism": 2,
    "failure_mode": "fail_fast",
    "budgets": {
      "wall_time_ms": 60000,
      "model_tokens": 10000,
      "monetary_microunits": 1000000
    },
    "loops": []
  },
  "policies": {
    "security_policy_digest": "sha256:7777777777777777777777777777777777777777777777777777777777777777",
    "policy_epoch": 1,
    "default_cache_mode": "exact_only",
    "budget": {
      "wall_time_ms": 60000,
      "model_tokens": 10000,
      "monetary_microunits": 1000000
    },
    "permissions": {
      "capabilities": [
        "model.invoke",
        "process.exec",
        "repo.read",
        "repo.write"
      ],
      "filesystem": {
        "read": [
          "workspace://snapshot",
          "workspace://snapshot-out"
        ],
        "write": [
          "workspace://snapshot-out"
        ]
      },
      "network": "deny",
      "secrets": []
    }
  }
}
